Term,Description
"In the UK,farmas an agricultural unit, a...","In the UK,farmas an agricultural unit, always denotes the area ofpastureand other fields together with its farmhouse, farmyard and outbuildings. Large farms, or groups of farms under the same ownership, may be called an estate. Conversely, a small farm surrounding the owner's dwelling is called asmallholdingand is generally focused onself-sufficiencywith only the surplus being sold."
"In Europe, traditional family farms are ...","In Europe, traditional family farms are giving way to larger production units whereindustrial agricultureandmechanizationbrings largecropyields.[9]"
TheCommon Agricultural Policy(CAP) is on...,"TheCommon Agricultural Policy(CAP) is one of the most important policies of the European Union and is helping in the change of farms from traditional family farms to larger production units. The policy has the objectives of increasing agricultural production, providing certainty in food supplies, ensuring a high quality of life for farmers, stabilizing markets, and ensuring reasonable prices for consumers.[28]It was, until recently, operated by a system ofsubsidiesand market intervention. Until the 1990s, the policy accounted for over 60 per cent of the European Union's annual budget, and as of 2013 accounts for around 34 per cent.[29]"
"According to theWorld Bank, ""most empiri...","According to theWorld Bank, ""most empirical evidence indicates that land productivity on large farms in Pakistan is lower than that of small farms, holding other factors constant."" Small farmers have ""higher net returns per hectare"" than large farms, according to farm
household income data.[30]"
Nepalis an agricultural country and abou...,Nepalis an agricultural country and about 80% of the total population are engaged in farming. Rice is mainly produced in Nepal along with fruits like apples.[31]Dairy farming and poultry farming are also growing inNepal.
Farmingis a significant economic sector ...,Farmingis a significant economic sector inAustralia. A farm is an area of land used for primary production which will include buildings.
"According to the UN, ""green agriculture ...","According to the UN, ""green agriculture directs a greater share of total farming input expenditures towards the purchase of locally sourced input?(e.g. labour and organic fertilisers) and a local multiplier effect is expected to kick in. Overall, green farming practices tend to require more labour inputs than conventional farming (e.g. from comparable levels to as much as 30 per cent more) (FAO 2007 and European Commission 2010), creating jobs in rural areas and a higher return on labour inputs.""[32]"
Where most of the income is from some ot...,"Where most of the income is from some other employment, and the farm is really an expanded residence, the termhobby farmis common. This will allow sufficient size for recreational use but be very unlikely to produce sufficient income to be self-sustaining. Hobby farms are commonly around 2 hectares (4.9 acres) but may be much larger depending upon land prices (which vary regionally)."
Often very small farms used for intensiv...,"Often very small farms used for intensive primary production are referred to by the specialization they are being used for, such as a dairy rather than a dairy farm, a piggery, a market garden, etc. This also applies to feedlots, which are specifically developed to a single purpose and are often not able to be used for more general purpose (mixed) farming practices."
In remote areas farms can become quite l...,"In remote areas farms can become quite large. As withestatesin England, there is no defined size or method of operation at which a large farm becomes astation."
A farm in Africa includes various struct...,"A farm in Africa includes various structures. Depending on climate-related areas primarily farming is the raising and breeding of grazing livestock, such as cattle, sheep, ostriches, horses or goats.  Predominantly domestic animals are raised for their meat, milk, skin, leather or fiber wool). You might even come across silk farms.[33]"
"Furthermore, there are plenty of hunting...","Furthermore, there are plenty of hunting farms, guest farms andgame farms. Arable] or irrigated land is often used for raising crops such as feed grains and hay for animal feeding."
On some farms (Astro Farm) star-gazing b...,On some farms (Astro Farm) star-gazing became very popular because of the excellent optical quality in the desert.[34]TheHigh Energy Stereoscopic System(H.E.S.S.) which investigatescosmicgamma raysis situated onFarm GöllschauinNamibia.
Farm equipment has evolved over the cent...,"Farm equipment has evolved over the centuries from simple hand tools such as thehoe, through ox- or horse-drawn equipment such as the plough andharrow, to the modern highly technical machinery such as thetractor,balerandcombine harvesterreplacing what was a highly labour-intensive occupation before theIndustrial Revolution. Today much of the farm equipment used on both small[35]and large farms is automated (e.g. usingsatelliteguided farming).[36]"
As new types of high-tech farm equipment...,"As new types of high-tech farm equipment have become inaccessible to farmers that historically fixed their own equipment,Wiredmagazine reports there is a growing backlash,[37]due mostly to companies usingintellectual propertylaw to prevent farmers from having the legal right to fix their equipment (or gain access to the information to allow them to do it).[38]This has encouraged groups such asOpen Source Ecologyand Farm Hack[39]to begin to makeopen source hardwarefor agricultural machinery. In addition on a smaller scaleFarmbot[40]and theRepRapopen source3D printercommunity has begun to make open-source farm tools available of increasing levels of sophistication.[41]"
Agricultural soil scienceis a branch ofs...,"Agricultural soil scienceis a branch ofsoil sciencethat deals with the study ofedaphicconditions as they relate to theproduction of foodandfiber.  In this context, it is also a constituent of the field ofagronomyand is thus also described assoil agronomy."
Prior to the development ofpedologyin th...,"Prior to the development ofpedologyin the 19th century, agricultural soil science (oredaphology) was the only branch of soil science. The bias of early soil science toward viewing soils only in terms of their agricultural potential continues to define the soil science profession in both academic and popular settings as of 2006[update]. (Baveye, 2006)"
Agricultural soil science follows the ho...,Agricultural soil science follows the holistic method. Soil is investigated in relation to and as integral part of terrestrial ecosystems but is also recognized as amanageablenatural resource.
Agricultural soil science studies the ch...,"Agricultural soil science studies the chemical, physical, biological, and mineralogical composition of soils as they relate to agriculture. Agricultural soil scientists develop methods that will improve the use of soil and increase the production of food and fiber crops. Emphasis continues to grow on the importance of soil sustainability.Soil degradationsuch as erosion, compaction, lowered fertility, and contamination continue to be serious concerns.[1]They conduct research inirrigationanddrainage,tillage,soil classification,plant nutrition,soil fertility, and other areas."
Although maximizing plant (and thus anim...,"Although maximizing plant (and thus animal) production is a valid goal, sometimes it may come at high cost which can be readily evident (e.g. massivecrop diseasestemming frommonoculture) or long-term (e.g. impact of chemical fertilizers and pesticides on human health). An agricultural soil scientist may come up with a plan that can maximize production using sustainable methods and solutions, and in order to do that they must look into a number of science fields includingagricultural science,physics,chemistry,biology,meteorologyandgeology."
Some soil variables of special interest ...,Some soil variables of special interest to agricultural soil science are
Soil scientists use a soil classificatio...,Soil scientists use a soil classification system to describe soil qualities. TheInternational Union of Soil Sciencesendorses theWorld Reference Baseas the international standard.[2]
Agricultural soil scientists study ways ...,"Agricultural soil scientists study ways to makesoilsmoreproductive. They classify soils and test them to determine whether they contain nutrients vital to plant growth. Such nutritional substances include compounds ofnitrogen,phosphorus, andpotassium. If a certain soil is deficient in these substances,fertilizersmay provide them. Agricultural soil scientists investigate the movement ofnutrientsthrough the soil, and the amount of nutrients absorbed by a plant'sroots. Agricultural soil scientists also examine the development of roots and their relation to the soil. Some agricultural soil scientists try to understand the structure and function of soils in relation to soil fertility. They grasp the structure of soil as porous solid. The solid frames of soil consist of mineral derived from the rocks and organic matter originated from the dead bodies of various organisms. The pore space of the soil is essential for the soil to become productive. Small pores serve as water reservoir supplying water to plants and other organisms in the soil during the rain-less period. The water in the small pores of soils is not pure water; they call it soil solution. In soil solution, various plant nutrients derived from minerals and organic matters in the soil are there. This is measured through thecation exchange capacity. Large pores serve as water drainage pipe to allow the excessive water pass through the soil, during the heavy rains. They also serve as air tank to supply oxygen to plant roots  and other living beings in the soil."
"In addition, agricultural soil scientist...","In addition, agricultural soil scientists develop methods to preserve the agricultural productivity of soil and to decrease the effects on productivity oferosionby wind and water. For example, a technique calledcontour plowingmay be used to prevent soil erosion and conserve rainfall. Researchers in agricultural soil science also seek ways to use the soil more effectively in addressing associated challenges.  Such challenges include thebeneficial reuseof human and animal wastes using agricultural crops; agriculturalsoil managementaspects of preventingwater pollutionand the build-up in agricultural soil of chemicalpesticides.Regenerative agriculturepractices can be used to address these challenges and rebuild soil health."
Most agricultural soil scientists are co...,"Most agricultural soil scientists are consultants, researchers, or teachers. Many work in thedeveloped worldas farm advisors,agricultural experiment stations, federal, state or local government agencies, industrial firms, or universities. Within the USA they may be trained through theUSDA'sCooperative Extension Serviceoffices, although other countries may use universities,research institutesor research agencies. Elsewhere, agricultural soil scientists may serve in international organizations such as theAgency for International Developmentand theFood and Agriculture Organizationof the United Nations."
[The key objective of the soil science d...,[The key objective of the soil science discipline is that of] finding ways to meet growinghuman needsfor food and fiber while maintainingenvironmental stabilityandconserving resourcesfor future generations
Many people have the vague notion that s...,Many people have the vague notion that soil science is merely a phase ofagronomyand deals only with practicalsoil managementfor field crops. Whether we like it or not this is the image many have of us
"Agricultural engineering, also known asa...","Agricultural engineering, also known asagricultural and biosystems engineering, is the field of study and application ofengineeringscience and designs principles foragriculturepurposes, combining the various disciplines ofmechanical,civil,electrical,food science,environmental,software, andchemical engineeringto improve the efficiency offarmsandagribusiness enterprises[1]as well as to ensure sustainability of natural and renewable resources.[2]"
An agricultural engineer is anengineerwi...,"An agricultural engineer is anengineerwith anagriculturebackground. Agricultural engineers make the engineering designs and plans in an agricultural project, usually in partnership with anagriculturistwho is more proficient infarmingandagricultural science."
The first use of agricultural engineerin...,"The first use of agricultural engineering was the introduction ofirrigationin large scale agriculture in theNileand theEuphratesrivers before 2000 B.C. Large irrigation structures were also present inBaluchistanandIndiabeforeChristian era. In other parts of Asia, agricultural engineering was heavily present inChina. In South America irrigation was practiced inPeruby theIncasand in North America by theAztecs.[3]"
The earliest plough was theardor scratch...,The earliest plough was theardor scratch-plough.[4]
Settlers practiced irrigation in the vic...,"Settlers practiced irrigation in the vicinity ofSan Antonioin 1715, theMormonspracticed irrigation inSalt Lake Valleyin 1847.[3]"
With growingmechanizationandsteam poweri...,"With growingmechanizationandsteam powerin theIndustrial Revolution, a new age in agricultural engineering began. Over the course of the Industrial Revolution,mechanical harvestersandplanterswould replace field hands in most of the food andcash cropindustries.Mechanical threshingwas introduced in 1761 by John Lloyd, Magnus Strindberg and Dietrich. Beater barthreshingmachine was built byAndrew Meiklein 1786.[5]Acast ironplowwas first made byCharles Newboldbetween 1790 and 1796.[3]"
James Smithconstructed amowerin 1811.Geo...,James Smithconstructed amowerin 1811.George Berryused a steamcombine harvesterin 1886.[5]John Deeremade his firststeel plowin 1833. The two horsecultivatorwas first about 1861.[3]
The introduction of these engineering co...,"The introduction of these engineering concepts into the field of agriculture allowed for an enormous boost in the productivity of crops, dubbed a ""second agricultural revolution"" which consisted of:[6]"
"In the 20th century, with the rise in re...","In the 20th century, with the rise in reliable engines in airplanes,cropdusterswere implemented to disperse pesticides.Benjamin Holtbuilt a combine harvester powered bypetrolin 1911.Erwin Peuckerconstructedbulldog tractors1936.Deutz-Fahrproduced the rotaryhay tedderin 1961.[5]"
"In the late 20th century,genetically mod...","In the late 20th century,genetically modified foods(GMOs) were created, giving another large boost to crop yields and resistance to pests.[7]"
Agricultural engineering has many sub-di...,"Agricultural engineering has many sub-disciplines, the most common of which are listed here:"
Agricultural machinery...,Agricultural machinery
Agricultural structures...,Agricultural structures
Agricultural surveying...,Agricultural surveying
Aquaculture...,Aquaculture
Biomechanics and ergonomics...,Biomechanics and ergonomics
Forestry engineering...,Forestry engineering
Irrigation...,Irrigation
Land development...,Land development
Pesticides...,Pesticides
Precision agriculture...,Precision agriculture
Soil management...,Soil management
Agricultural engineers may perform tasks...,"Agricultural engineers may perform tasks such as planning, supervising and managing the building of dairy effluent schemes,irrigation,drainage,floodwater control systems, performingenvironmental impact assessments,agriculturalproductprocessingand interpret research results and implement relevant practices. A large percentage of agricultural engineers work in academia or for government agencies. Some are consultants, employed by private engineering firms, while others work in industry, for manufacturers of agricultural machinery, equipment, processing technology, and structures for housing livestock and storing crops. Agricultural engineers work in production, sales,management,researchand development, orapplied science."
In 2006 Armenia's agricultural sector ac...,"In 2006 Armenia's agricultural sector accounted for about 20 percent of the GDP. By 2010, it grew to about 25 percent.[8]This was and is higher than in Armenia's neighboring countries of Georgia, Azerbaijan, Turkey and Iran, in which the contribution of agriculture to the GDP in 2017 was 6.88, 5.63, 6.08 and 9.05 percent, respectively.[9]"
"In thePhilippines, the professional desi...","In thePhilippines, the professional designation isregistered agricultural and biosystems engineer. They are licensed and accredited after successfully passing the Agricultural and Biosystems Engineering Licensure Examination. A prospective agricultural and biosystems engineer is required to have a four-yearBachelor of Sciencein Agricultural and Biosystems Engineering."
The practice of agricultural and biosyst...,The practice of agricultural and biosystems engineering also includes the following:
In the United Kingdom the term agricultu...,In the United Kingdom the term agricultural engineer is often also used to describe a person that repairs or modifies agricultural equipment.
The American Society of Agricultural Eng...,"The American Society of Agricultural Engineers, now known as theAmerican Society of Agricultural and Biological Engineers(ASABE), was founded in 1907.[10]It is a leading organization in the agricultural engineering field. The ASABE provides safety and regulatory standards for the agricultural industry. Thesestandardsand regulations are developed on an international scale for fertilizers, soil conditions, fisheries, biofuels, biogas, feed machinery, tractors, and machinery.[1]"
Agronomyis the science and technology of...,"Agronomyis the science and technology of producing and usingplantsbyagricultureforfood,fuel,fiber, chemicals, recreation, or land conservation. Agronomy has come to include research ofplant genetics,plant physiology,meteorology, andsoil science. It is the application of a combination of sciences such asbiology,chemistry,economics,ecology,earth science, andgenetics. Professionals of agronomy are termedagronomists."
Agronomy has a long and rich history dat...,"Agronomy has a long and rich history dating to theNeolithic Revolution. Some of the earliest practices of agronomy are found in ancient civilizations, includingAncient Egypt,Mesopotamia,ChinaandIndia. They developed various techniques for the management ofsoil fertility,irrigationandcrop rotation."
"During the 18th and 19th centuries, adva...","During the 18th and 19th centuries, advances in science led to the development of modern agronomy. German chemistJustus von LiebigandJohn Bennett Lawes, an English entrepreneur, contributed to the understanding ofplant nutritionandsoil chemistry. Their work laid for the establishment of modern fertilizers and agricultural practices."
Agronomy continued to evolve with the de...,"Agronomy continued to evolve with the development of new technology and practices in the 20th century. From the 1960s, theGreen Revolutionsaw the introduction of high-yield variety of crops, modern fertilizers and improvement of agricultural practices. It led to an increase of global food production to help reduce hunger and poverty in many parts of the world."
This topic of agronomy involvesselective...,"This topic of agronomy involvesselective breedingof plants to produce the bestcropsfor various conditions. Plant breeding has increasedcrop yieldsand has improved thenutritional valueof numerous crops, includingcorn,soybeans, andwheat. It has also resulted in the development of new types of plants. For example, ahybridgrain namedtriticalewas produced by crossbreeding rye and wheat. Triticale contains more usableproteinthan does either rye or wheat. Agronomy has also been instrumental for fruit and vegetable production research. Furthermore, the application of plant breeding for turfgrass development has resulted in a reduction in the demand for fertilizer and water inputs (requirements), as well as turf-types with higher disease resistance."
Agronomists usebiotechnologyto extend an...,Agronomists usebiotechnologyto extend and expedite the development of desired characteristics.[1]Biotechnology is often a laboratory activity requiring field testing of new crop varieties that are developed.
In addition to increasing crop yields ag...,"In addition to increasing crop yields agronomic biotechnology is being applied increasingly for novel uses other than food. For example,oilseedis at present used mainly for margarine and other food oils, but it can be modified to produce fatty acids fordetergents, substitute fuels andpetrochemicals."
Agronomists study sustainable ways to ma...,"Agronomists study sustainable ways to makesoilsmore productive and profitable. They classify soils and analyze them to determine whether they contain nutrients vital for plant growth. Common macronutrients analyzed include compounds ofnitrogen,phosphorus,potassium,calcium,magnesium, andsulfur. Soil is also assessed for several micronutrients, likezincandboron. The percentage of organic matter,soil pH, and nutrient holding capacity (cation exchange capacity) are tested in a regional laboratory. Agronomists will interpret these laboratory reports and make recommendations to modify soil nutrients for optimal plant growth.[2]"
"Additionally, agronomists develop method...","Additionally, agronomists develop methods to preserve soil and decrease the effects of [erosion] by wind and water. For example, a technique known ascontour plowingmay be used to prevent soil erosion and conserve rainfall. Researchers of agronomy also seek ways to use the soil more effectively for solving other problems. Such problems include the disposal of human and animalmanure,water pollution, andpesticideaccumulation in the soil, as well as preserving the soil for future generations such as the burning of paddocks after crop production. Pasture management techniques includeno-till farming, planting of soil-binding grasses along contours on steep slopes, and using contour drains of depths as much as 1 metre.[3]"
Agroecologyis the management of agricult...,"Agroecologyis the management of agricultural systems with an emphasis on ecological and environmental applications.[4]This topic is associated closely with work forsustainable agriculture,organic farming, andalternative food systemsand the development of alternative cropping systems.[5]"
Theoretical production ecologyis the qua...,"Theoretical production ecologyis the quantitative study of the growth of crops. The plant is treated as a kind of biological factory, which processeslight,carbon dioxide,water, andnutrientsinto harvestable products. The main parameters considered are temperature, sunlight, standing crop biomass, plant production distribution, and nutrient and water supply.[citation needed]"
